<xs:schema attributeFormDefault="unqualified" elementFormDefault="qualified" xmlns:xs="http://www.w3.org/2001/XMLSchema">
  	<xs:element name="events">
    		<xs:complexType>
      			<xs:sequence>
        			<xs:element name="event">
          				<xs:complexType>
            					<xs:sequence>
              						<xs:element name="config" maxOccurs="unbounded" minOccurs="0">
                						<xs:complexType>
                  							<xs:simpleContent>
                    								<xs:extension base="xs:string">
                      									<xs:attribute type="xs:string" name="name" use="optional"/>
                      									<xs:attribute type="xs:string" name="value" use="optional"/>
                    								</xs:extension>
                  							</xs:simpleContent>
                						</xs:complexType>
              						</xs:element>
              						<xs:element name="color" maxOccurs="unbounded" minOccurs="0">
                                                        	<xs:complexType>
                                                                	<xs:simpleContent>
                    								<xs:extension base="xs:string">
                      									<xs:attribute type="xs:string" name="owner" use="optional"/>
                      									<xs:attribute type="xs:short" name="r" use="optional"/>
                      									<xs:attribute type="xs:short" name="g" use="optional"/>
                      									<xs:attribute type="xs:short" name="b" use="optional"/>
                    								</xs:extension>
                  							</xs:simpleContent>
                						</xs:complexType>
              						</xs:element>
              						<xs:element name="position" maxOccurs="unbounded" minOccurs="0">
                						<xs:complexType>
                  							<xs:simpleContent>
                    								<xs:extension base="xs:string">
                      									<xs:attribute type="xs:string" name="owner" use="optional"/>
                       									<xs:attribute type="xs:int" name="x" use="optional"/>
                       									<xs:attribute type="xs:int" name="y" use="optional"/>
                       									<xs:attribute type="xs:short" name="z" use="optional"/>
                       									<xs:attribute type="xs:short" name="radius" use="optional"/>
                     								</xs:extension>
                  							</xs:simpleContent>
                						</xs:complexType>
              						</xs:element>
              						<xs:element name="restriction" maxOccurs="unbounded" minOccurs="0">
                						<xs:complexType>
                  							<xs:simpleContent>
                    								<xs:extension base="xs:string">
                      									<xs:attribute type="xs:string" name="type" use="optional"/>
                      									<xs:attribute type="xs:int" name="ids" use="optional"/>
                    								</xs:extension>
                  							</xs:simpleContent>
                						</xs:complexType>
              						</xs:element>
              						<xs:element name="reward" maxOccurs="unbounded" minOccurs="0">
                						<xs:complexType>
                  							<xs:simpleContent>
                    								<xs:extension base="xs:string">
                      									<xs:attribute type="xs:string" name="owner" use="optional"/>
                      									<xs:attribute type="xs:string" name="list" use="optional"/>
                    								</xs:extension>
                  							</xs:simpleContent>
                						</xs:complexType>
              						</xs:element>
            					</xs:sequence>
            					<xs:attribute type="xs:byte" name="id"/>
          				</xs:complexType>
        			</xs:element>
      			</xs:sequence>
    		</xs:complexType>
  	</xs:element>
</xs:schema>